{
  "$schema": "./card-catalog.schema.json",
  "schemaVersion": 1,
  "modelVersion": "1.0.0",
  "gameId": "splendor",
  "rulesEdition": "base-2024-refresh",
  "generatedFrom": [
    "./development-cards.csv",
    "./nobles.csv"
  ],
  "sourceDigestSha256": "e0b2e797fd6ebee3dfcabfd9bf7d3d36474016a8b1782cde988e3d23dd4dc144",
  "sourceBasis": [
    "https://cdn.svc.asmodee.net/production-spacecowboys/uploads/2025/10/SCSPL01EN_SPLENDOR_RULES_LIGHT.pdf",
    "https://raw.githubusercontent.com/anicolao/splendor/main/data/verified_card_properties.csv",
    "https://raw.githubusercontent.com/bouk/splendimax/refs/heads/master/Splendor%20Cards.csv"
  ],
  "componentSummary": {
    "developmentCards": 90,
    "developmentCardsByLevel": {
      "1": 40,
      "2": 30,
      "3": 20
    },
    "developmentCardsPerBonusColor": 18,
    "nobleTiles": 10
  },
  "colors": [
    {
      "id": "white",
      "nameZh": "钻石",
      "symbol": "◇",
      "semanticColor": "#E8E3D8",
      "pattern": "dot-grid"
    },
    {
      "id": "blue",
      "nameZh": "蓝宝石",
      "symbol": "◆",
      "semanticColor": "#3A739A",
      "pattern": "wave"
    },
    {
      "id": "green",
      "nameZh": "祖母绿",
      "symbol": "⬟",
      "semanticColor": "#4E8068",
      "pattern": "leaf"
    },
    {
      "id": "red",
      "nameZh": "红宝石",
      "symbol": "⬢",
      "semanticColor": "#A8524B",
      "pattern": "chevron"
    },
    {
      "id": "black",
      "nameZh": "缟玛瑙",
      "symbol": "●",
      "semanticColor": "#353A3D",
      "pattern": "crosshatch"
    },
    {
      "id": "gold",
      "nameZh": "黄金百搭",
      "symbol": "★",
      "semanticColor": "#C79B43",
      "pattern": "sunburst"
    }
  ],
  "developmentCards": [
    {
      "id": "dev-white-1-01",
      "kind": "development",
      "level": 1,
      "bonusColor": "white",
      "prestige": 0,
      "cost": {
        "white": 0,
        "blue": 3,
        "green": 0,
        "red": 0,
        "black": 0
      },
      "totalCost": 3,
      "visual": {
        "framePattern": "white-functional",
        "artworkSlot": "original-level-1-merchant-scene",
        "officialArtworkIncluded": false
      },
      "accessibility": {
        "labelZh": "1 级钻石奖励发展卡，0 点威望；费用：蓝宝石 3",
        "compactLabelZh": "1级 钻石 +1，0分"
      }
    },
    {
      "id": "dev-white-1-02",
      "kind": "development",
      "level": 1,
      "bonusColor": "white",
      "prestige": 1,
      "cost": {
        "white": 0,
        "blue": 0,
        "green": 4,
        "red": 0,
        "black": 0
      },
      "totalCost": 4,
      "visual": {
        "framePattern": "white-functional",
        "artworkSlot": "original-level-1-merchant-scene",
        "officialArtworkIncluded": false
      },
      "accessibility": {
        "labelZh": "1 级钻石奖励发展卡，1 点威望；费用：祖母绿 4",
        "compactLabelZh": "1级 钻石 +1，1分"
      }
    },
    {
      "id": "dev-white-1-03",
      "kind": "development",
      "level": 1,
      "bonusColor": "white",
      "prestige": 0,
      "cost": {
        "white": 0,
        "blue": 0,
        "green": 0,
        "red": 2,
        "black": 1
      },
      "totalCost": 3,
      "visual": {
        "framePattern": "white-functional",
        "artworkSlot": "original-level-1-merchant-scene",
        "officialArtworkIncluded": false
      },
      "accessibility": {
        "labelZh": "1 级钻石奖励发展卡，0 点威望；费用：红宝石 2、缟玛瑙 1",
        "compactLabelZh": "1级 钻石 +1，0分"
      }
    },
    {
      "id": "dev-white-1-04",
      "kind": "development",
      "level": 1,
      "bonusColor": "white",
      "prestige": 0,
      "cost": {
        "white": 0,
        "blue": 2,
        "green": 0,
        "red": 0,
        "black": 2
      },
      "totalCost": 4,
      "visual": {
        "framePattern": "white-functional",
        "artworkSlot": "original-level-1-merchant-scene",
        "officialArtworkIncluded": false
      },
      "accessibility": {
        "labelZh": "1 级钻石奖励发展卡，0 点威望；费用：蓝宝石 2、缟玛瑙 2",
        "compactLabelZh": "1级 钻石 +1，0分"
      }
    },
    {
      "id": "dev-white-1-05",
      "kind": "development",
      "level": 1,
      "bonusColor": "white",
      "prestige": 0,
      "cost": {
        "white": 3,
        "blue": 1,
        "green": 0,
        "red": 0,
        "black": 1
      },
      "totalCost": 5,
      "visual": {
        "framePattern": "white-functional",
        "artworkSlot": "original-level-1-merchant-scene",
        "officialArtworkIncluded": false
      },
      "accessibility": {
        "labelZh": "1 级钻石奖励发展卡，0 点威望；费用：钻石 3、蓝宝石 1、缟玛瑙 1",
        "compactLabelZh": "1级 钻石 +1，0分"
      }
    },
    {
      "id": "dev-white-1-06",
      "kind": "development",
      "level": 1,
      "bonusColor": "white",
      "prestige": 0,
      "cost": {
        "white": 0,
        "blue": 2,
        "green": 2,
        "red": 0,
        "black": 1
      },
      "totalCost": 5,
      "visual": {
        "framePattern": "white-functional",
        "artworkSlot": "original-level-1-merchant-scene",
        "officialArtworkIncluded": false
      },
      "accessibility": {
        "labelZh": "1 级钻石奖励发展卡，0 点威望；费用：蓝宝石 2、祖母绿 2、缟玛瑙 1",
        "compactLabelZh": "1级 钻石 +1，0分"
      }
    },
    {
      "id": "dev-white-1-07",
      "kind": "development",
      "level": 1,
      "bonusColor": "white",
      "prestige": 0,
      "cost": {
        "white": 0,
        "blue": 1,
        "green": 1,
        "red": 1,
        "black": 1
      },
      "totalCost": 4,
      "visual": {
        "framePattern": "white-functional",
        "artworkSlot": "original-level-1-merchant-scene",
        "officialArtworkIncluded": false
      },
      "accessibility": {
        "labelZh": "1 级钻石奖励发展卡，0 点威望；费用：蓝宝石 1、祖母绿 1、红宝石 1、缟玛瑙 1",
        "compactLabelZh": "1级 钻石 +1，0分"
      }
    },
    {
      "id": "dev-white-1-08",
      "kind": "development",
      "level": 1,
      "bonusColor": "white",
      "prestige": 0,
      "cost": {
        "white": 0,
        "blue": 1,
        "green": 2,
        "red": 1,
        "black": 1
      },
      "totalCost": 5,
      "visual": {
        "framePattern": "white-functional",
        "artworkSlot": "original-level-1-merchant-scene",
        "officialArtworkIncluded": false
      },
      "accessibility": {
        "labelZh": "1 级钻石奖励发展卡，0 点威望；费用：蓝宝石 1、祖母绿 2、红宝石 1、缟玛瑙 1",
        "compactLabelZh": "1级 钻石 +1，0分"
      }
    },
    {
      "id": "dev-blue-1-01",
      "kind": "development",
      "level": 1,
      "bonusColor": "blue",
      "prestige": 0,
      "cost": {
        "white": 0,
        "blue": 0,
        "green": 0,
        "red": 0,
        "black": 3
      },
      "totalCost": 3,
      "visual": {
        "framePattern": "blue-functional",
        "artworkSlot": "original-level-1-merchant-scene",
        "officialArtworkIncluded": false
      },
      "accessibility": {
        "labelZh": "1 级蓝宝石奖励发展卡，0 点威望；费用：缟玛瑙 3",
        "compactLabelZh": "1级 蓝宝石 +1，0分"
      }
    },
    {
      "id": "dev-blue-1-02",
      "kind": "development",
      "level": 1,
      "bonusColor": "blue",
      "prestige": 1,
      "cost": {
        "white": 0,
        "blue": 0,
        "green": 0,
        "red": 4,
        "black": 0
      },
      "totalCost": 4,
      "visual": {
        "framePattern": "blue-functional",
        "artworkSlot": "original-level-1-merchant-scene",
        "officialArtworkIncluded": false
      },
      "accessibility": {
        "labelZh": "1 级蓝宝石奖励发展卡，1 点威望；费用：红宝石 4",
        "compactLabelZh": "1级 蓝宝石 +1，1分"
      }
    },
    {
      "id": "dev-blue-1-03",
      "kind": "development",
      "level": 1,
      "bonusColor": "blue",
      "prestige": 0,
      "cost": {
        "white": 1,
        "blue": 0,
        "green": 0,
        "red": 0,
        "black": 2
      },
      "totalCost": 3,
      "visual": {
        "framePattern": "blue-functional",
        "artworkSlot": "original-level-1-merchant-scene",
        "officialArtworkIncluded": false
      },
      "accessibility": {
        "labelZh": "1 级蓝宝石奖励发展卡，0 点威望；费用：钻石 1、缟玛瑙 2",
        "compactLabelZh": "1级 蓝宝石 +1，0分"
      }
    },
    {
      "id": "dev-blue-1-04",
      "kind": "development",
      "level": 1,
      "bonusColor": "blue",
      "prestige": 0,
      "cost": {
        "white": 0,
        "blue": 0,
        "green": 2,
        "red": 0,
        "black": 2
      },
      "totalCost": 4,
      "visual": {
        "framePattern": "blue-functional",
        "artworkSlot": "original-level-1-merchant-scene",
        "officialArtworkIncluded": false
      },
      "accessibility": {
        "labelZh": "1 级蓝宝石奖励发展卡，0 点威望；费用：祖母绿 2、缟玛瑙 2",
        "compactLabelZh": "1级 蓝宝石 +1，0分"
      }
    },
    {
      "id": "dev-blue-1-05",
      "kind": "development",
      "level": 1,
      "bonusColor": "blue",
      "prestige": 0,
      "cost": {
        "white": 0,
        "blue": 1,
        "green": 3,
        "red": 1,
        "black": 0
      },
      "totalCost": 5,
      "visual": {
        "framePattern": "blue-functional",
        "artworkSlot": "original-level-1-merchant-scene",
        "officialArtworkIncluded": false
      },
      "accessibility": {
        "labelZh": "1 级蓝宝石奖励发展卡，0 点威望；费用：蓝宝石 1、祖母绿 3、红宝石 1",
        "compactLabelZh": "1级 蓝宝石 +1，0分"
      }
    },
    {
      "id": "dev-blue-1-06",
      "kind": "development",
      "level": 1,
      "bonusColor": "blue",
      "prestige": 0,
      "cost": {
        "white": 1,
        "blue": 0,
        "green": 2,
        "red": 2,
        "black": 0
      },
      "totalCost": 5,
      "visual": {
        "framePattern": "blue-functional",
        "artworkSlot": "original-level-1-merchant-scene",
        "officialArtworkIncluded": false
      },
      "accessibility": {
        "labelZh": "1 级蓝宝石奖励发展卡，0 点威望；费用：钻石 1、祖母绿 2、红宝石 2",
        "compactLabelZh": "1级 蓝宝石 +1，0分"
      }
    },
    {
      "id": "dev-blue-1-07",
      "kind": "development",
      "level": 1,
      "bonusColor": "blue",
      "prestige": 0,